{
  "schemaVersion": "1.0.0",
  "caseId": "case_json_path_equals_missing_expected",
  "projectId": 1001,
  "apiId": "api_create_order",
  "name": "JSON path equals without expected",
  "environment": {
    "baseUrl": "http://localhost:8080",
    "variables": {}
  },
  "steps": [
    {
      "stepId": "step_001",
      "name": "Submit request",
      "request": {
        "method": "GET",
        "path": "/api/orders"
      },
      "assertions": [
        {
          "type": "JSON_PATH",
          "expression": "$.code",
          "operator": "EQUALS"
        }
      ],
      "extractors": []
    }
  ]
}
